title,content
"জামায়াতকে যদি ভোট দেন, তাইলে আমার মৃতদেহ পাবেন: বিএনপি নেতা ফজলুর রহমান","কিশোরগঞ্জ-৪ আসনে বিএনপি-মনোনীত প্রার্থী বীর মুক্তিযোদ্ধা ফজলুর রহমান তাঁর কর্মী-সমর্থকদের উদ্দেশে বলেছেন, ‘জামায়াতকে যদি ভোট দেন, তাইলে আমার মৃতদেহ পাবেন।’ শুক্রবার (২৮ নভেম্বর) বিকেলে কিশোরগঞ্জের ইটনা উপজেলার মৃগা ইউনিয়ন বিএনপি, অঙ্গ ও সহযোগী সংগঠন আয়োজিত কর্মী সম্মেলনে প্রধান অতিথির বক্তব্যে তিনি এই মন্তব্য করেন।
সম্মেলনে বিএনপির চেয়ারপারসনের উপদেষ্টা ফজলুর রহমান বলেন, ‘বন্ধুরা, আমি আজকে আপনাদের কাছে খুব খারাপ মানুষ। এই কারণে খারাপ মানুষ আপনাদের জন্য আমি সম্মান বয়ে আনতে পারি নাই। আপনাদের জন্য আমি একটা টাইটেল এনেছি। সেই টাইটেলটা হলো আমি হলাম “ফজা পাগলা”। যে...আমাকে এই টাইটেলটা দিয়েছে তাদের নাম হলো স্বাধীনতাবিরোধী মুক্তিযুদ্ধবিরোধী জামায়াত। তাদেরকে যদি ভোট দেন তাইলে আমার মৃতদেহ পাবেন।’ এরপর ফজলুর রহমান উপস্থিত সবার কাছে প্রশ্ন করেন, ‘তাদেরকে ভোট দেবেন আপনারা?’ অপর পাশ থেকে তখন সবাই সমস্বরে ‘না’ জবাব দেন।
ফজলুর রহমান আরও বলেন, ‘কালকেও আমাকে অন্তত ১০০টা বকা দেওয়া হয়েছে। কী বকা দেয়, বুঝবেন না আপনারা। সহ্য করা যায় না। আমার অপরাধ কী? আমি তো জামায়াতে ইসলাম, মুক্তিযুদ্ধবিরোধীদের বকি নাই। ৫ আগস্টের পর তারা বলতে শুরু করল, ১৯৪৭ সালে মুক্তিযুদ্ধ হয়েছিল আর ২০২৪ সালে শেষ মুক্তিযুদ্ধ হইছে। একাত্তর সনে একটা গন্ডগোল হইছিল। এই গন্ডগোলটা ইন্ডিয়া লাগাইয়া দিসিলো, একাত্তর সালে কোনো মুক্তিযুদ্ধ হয় নাই।’
ফজলুর রহমান বলেন, ‘যারা যুদ্ধ করে এই বাংলাদেশ স্বাধীন করেছে, আমি তাদের মধ্যে অন্যতম। বন্ধুরা, কাজেই যখন দেখলাম কেউ কথা বলে না; আমার দল যখন চুপ করে থাকে, তখন জীবন-মৃত্যুর রিস্ক (ঝুঁকি) নিয়ে বাঁ হাতের আঙুলটা তুলে আমি বললাম—এই রাজাকারের বাচ্চারা, এখনো কিন্তু জীবিত আছি রে। মুক্তিযুদ্ধ আছে, মুক্তিযুদ্ধ থাকবে। তোমরা যদি মুক্তিযুদ্ধকে শেষ করে দিতে চাও, তোমাদের সঙ্গে আরেকটা রাজনৈতিক যুদ্ধ হবে আমাদের।’
এ সময় ফজলুর রহমানের সহধর্মিণী জেলা বিএনপির সাবেক সহসভাপতি উম্মে কুলসুম রেখা, সাবেক সহসাধারণ সম্পাদক আমিনুল ইসলাম, ইটনা উপজেলা বিএনপির সভাপতি এস এম কামাল হোসেন, সাধারণ সম্পাদক সিদ্দিকুর রহমান স্বপন ঠাকুর প্রমুখ উপস্থিত ছিলেন।"
পাবনায় দুই দলের সংঘর্ষ: গুলি ছোড়া যুবককে নিয়ে বিএনপি–জামায়াতের পাল্টাপাল্টি দাবি,"পাবনার ঈশ্বরদীতে বিএনপি ও জামায়াতের নেতা–কর্মীদের মধ্যে সংঘর্ষের সময় এক যুবক অস্ত্র হাতে গুলি ছুড়ছেন, এমন একটি ছবি সামাজিক যোগাযোগমাধ্যম ফেসবুকে ছড়িয়ে পড়েছে।
বিএনপি নেতা–কর্মীরা দাবি করেন, অস্ত্রধারী ওই যুবক জামায়াত–শিবিরের কর্মী। অন্যদিকে জামায়াত নেতাদের দাবি, তিনি বিএনপির কর্মী।
গতকাল বৃহস্পতিবার বিকেলে উপজেলার সাহাপুর ইউনিয়নের চরগড়গড়ি গ্রামে নির্বাচনী প্রচারণা চালাতে গেলে জামায়াত ও বিএনপির এই সংঘর্ষের ঘটনা ঘটে। এতে উভয় পক্ষের অন্তত ২৫ জন আহত হন। ফেসবুকে ছড়ানো ছবিতে দেখা যায়, রাস্তায় বেশ কিছু লোকজনের জটলা। এর মধ্যে সাদা টি–শার্ট ও জিনসের প্যান্ট পরা এক যুবক ডান হাতে পিস্তল উঁচিয়ে গুলি ছুড়ছেন।
সাহাপুর ইউনিয়ন কৃষক দলের সভাপতি মক্কেল মৃধা দাবি করেন, গুলি চালানো ওই যুবকের নাম তুষার হোসেন। তাঁর বাড়ি ঈশ্বরদী পৌর শহরের ভেলুপাড়া মহল্লায়। তিনি জামায়াত–শিবিরের কর্মী। তাঁর গুলিতে বিএনপির কয়েকজন আহত হয়েছেন।
অন্যদিকে পাবনা–৪ (ঈশ্বরদী–আটঘরিয়া) আসনে জামায়াতের প্রার্থী ও জেলা জামায়াতের আমির আবু তালেব মন্ডল বলেন, ‘আমরা অস্ত্রের রাজনীতি করি না। আমাদের কোনো কর্মীর হাতে অস্ত্র ছিল না। আমরা গ্রামটিতে গণসংযোগে গিয়েছিলাম। আমাদের ওপর বিএনপির সন্ত্রাসীরা অতর্কিত হামলা চালিয়ে অর্ধশতাধিক নেতা–কর্মীকে আহত করেছে। তাঁদের কয়েকজনকে গুরুতর অবস্থায় রাজশাহী মেডিকেলে নেওয়া হয়েছে।’
ঈশ্বরদী থানার ভারপ্রাপ্ত কর্মকর্তা (ওসি) আ স ম আব্দুর নূর বলেন, ‘ঘটনায় দুই পক্ষই পাল্টাপাল্টি অভিযোগ করছে। আমরা বিষয়টি তদন্ত করছি। তদন্তের পর প্রয়োজনীয় ব্যবস্থা নেওয়া হবে।’
উল্লেখ্য, পাবনা–৪ আসনে বিএনপি মনোনীত প্রার্থী হিসেবে মাঠে কাজ করছেন বিএনপি চেয়ারপারসনের উপদেষ্টা ও জেলা বিএনপির আহ্বায়ক হাবিবুর রহমান। জামায়াত মনোনীত প্রার্থী হিসেবে আছেন জেলা জামায়াতের আমির আবু তালেব মন্ডল। উপজেলার চরগড়গড়ি গ্রামে কয়েক দিন ধরে দুই পক্ষের সমর্থকদের মধ্যে বিরোধ চলছিল। দুই দিন আগে তাদের মধ্যে কথা–কাটাকাটি ও হাতাহাতির ঘটনা ঘটে। এ পরিপ্রেক্ষিতে গতকাল বিকেলে জামায়াত মনোনীত প্রার্থী এলাকায় গণসংযোগে যান। এ সময় দুই পক্ষের মধ্যে কথা–কাটাকাটি, হাতাহাতি ও সংঘর্ষের ঘটনা ঘটে। সংঘর্ষে কয়েকটি গুলি ছোড়া হয় এবং কিছু মোটরসাইকেল ভাঙচুর করা হয়। এতে উভয় পক্ষের অন্তত ২৫ জন আহত হন। পরে স্থানীয় লোকজন তাঁদের উদ্ধার করে ঈশ্বরদী উপজেলা স্বাস্থ্য কমপ্লেক্স ও রাজশাহী মেডিকেল কলেজ হাসপাতালে ভর্তি করেন।"
ছাত্রদলে যোগ দিলেন ছাত্রশিবিরের সাবেক নেতা,"ইসলামী ছাত্রশিবিরের খাগড়াছড়ি জেলা শাখার সাবেক সেক্রেটারি মো. রুবেল ছাত্রদলে যোগ দিয়েছেন। রুবেলের সঙ্গে ছাত্রদলে যোগ দিয়েছেন তাঁর অর্ধশতাধিক অনুসারী। গতকাল রোববার সন্ধ্যায় খাগড়াছড়ি শহরের কলাবাগান এলাকায় কেন্দ্রীয় বিএনপির সহকর্মসংস্থান সম্পাদক ও খাগড়াছড়ি আসনের বিএনপির মনোনীত প্রার্থী ওয়াদুদ ভূঁইয়ার হাতে ফুলের তোড়া তুলে দিয়ে তাঁরা ছাত্রদলে যোগ দেন। এ সময় জেলা ছাত্রদলের নেতারা সেখানে উপস্থিত ছিলেন।
ছাত্রদলে নবাগত নেতাদের স্বাগত জানান ওয়াদুদ ভূঁইয়া। এ সময় তিনি বলেন, ‘আমরা আশা করি বিএনপি চেয়ারপারসন বেগম খালেদা জিয়া ও ভারপ্রাপ্ত চেয়ারম্যান তারেক রহমানের নেতৃত্বে নতুন বাংলাদেশ গঠনে ভূমিকা রাখবেন নবাগত নেতারা।’
খাগড়াছড়ি জেলা ছাত্রদলের সভাপতি আরিফ মোহাম্মদ, সাধারণ সম্পাদক সোহেল দেওয়ান, সাংগঠনিক সম্পাদক বাপ্পী দাশসহ নেতা-কর্মীরা নবাগত নেতাদের বরণ করে নেন। জানতে চাইলে মো. রুবেল বলেন, ‘ছাত্রশিবির ও জামায়াতে ইসলামীর কিছু বিষয় নিয়ে প্রশ্ন তৈরি হওয়ায় তিনি সংগঠন থেকে অব্যাহতি নিয়েছেন। ছাত্রদলে যোগদানের কারণে তাঁকে বিভিন্ন ধরনের হুমকি দেওয়া হচ্ছে।’
রুবেল জানান, ২০১২ সালে খাগড়াছড়ি সরকারি উচ্চবিদ্যালয়ে নবম শ্রেণিতে পড়ার সময় তিনি ইসলামী ছাত্রশিবিরে যোগ দেন। পরে তিনি খাগড়াছড়ির একাধিক উপজেলা শাখায় সভাপতির দায়িত্ব পালন করেন। পরে জেলা শাখার অফিস সম্পাদক, জেলা প্রশিক্ষণ সম্পাদক হয়ে সর্বশেষ ২০২৩ সালের জুলাই থেকে ২০২৪ সালের মে পর্যন্ত জেলা ছাত্রশিবিরের সেক্রেটারি পদে ছিলেন। বর্তমানে তিনি চট্টগ্রাম নগরের একটি কলেজে স্নাতক (সম্মান) চতুর্থ বর্ষে অধ্যয়নরত।
জেলা ছাত্রদলের সাংগঠনিক সম্পাদক বাপ্পী দাশ প্রথম আলোকে বলেন, ‘বিএনপির রাজনীতিকে ভালোবেসে স্বেচ্ছায় ছাত্রদলে যোগ দিয়েছেন মো. রুবেল। তাঁকে আমরা স্বাগত জানিয়েছি। সন্ত্রাসী ও নিষিদ্ধ সংগঠন ছাড়া যেকোনো দলের নেতা-কর্মীরা ছাত্রদলে যোগ দিতে চাইলে তাদের আমরা স্বাগত জানাব।’
মো. রুবেলের ছাত্রদলে যোগদান প্রসঙ্গে ছাত্রশিবিরের খাগড়াছড়ি জেলা শাখার সভাপতি আবদুস সাত্তার প্রথম আলোকে বলেন, সংগঠনের শৃঙ্খলা ভঙ্গের কারণে গত বছরের নভেম্বরে মো. রুবেলকে ছাত্রশিবির থেকে স্থায়ীভাবে বহিষ্কার করা হয়েছিল। এখন তিনি কোথায় যোগ দিয়েছেন, কী করছেন, সেটি একান্ত তাঁর নিজস্ব ব্যাপার। তাঁর সঙ্গে শিবিরের কোনো নেতা–কর্মী ছাত্রদলে যোগ দেননি।"
